{
  "schema": "euclid-min-geometry-algebra-ir/v1",
  "problem": "regular-17-adjacent-vertex",
  "profile": {
    "id": "regular-17-e-fixed-v1",
    "sha256": "bb0a4ea904e60fb688da15558fa8f09982d4a7eee3cd8efee32ae9cb61079014"
  },
  "source": {
    "certificate": "baselines/regular-17/detemple-1991-carlyle-improved-converted/construction.json",
    "certificate_sha256": "652ce4f04f264bf238e9e5cc7812ec568f90791b3b0a26e16a92c90eb819c13d",
    "construction_sha256": "2248c9683f876e4a87d0a1b0bacdd4ae40f21c2d9d121e9586a749d840d9264b"
  },
  "semantics": {
    "state": "monotone_points_drawables_representations",
    "charged_draw_operation_cost_e": 1,
    "intersection_binding_cost_e": 0,
    "closure": "all_finite_real_intersections_after_each_new_object",
    "contextual_cost": "number_of_distinct_new_drawables_in_context",
    "duplicate_draw_note": "正式 profile 仍对重复绘制收费；本基线没有重复对象，故收费成本与上下文新增对象成本相等。"
  },
  "arrangement": {
    "drawables": [
      {
        "id": "unit_circle",
        "operation": "initial_circle",
        "birth_e_move": 0
      },
      {
        "id": "x_axis",
        "operation": "line",
        "birth_e_move": 1
      },
      {
        "id": "c_A_Q",
        "operation": "circle",
        "birth_e_move": 2
      },
      {
        "id": "c_Q_A",
        "operation": "circle",
        "birth_e_move": 3
      },
      {
        "id": "y_axis",
        "operation": "line",
        "birth_e_move": 4
      },
      {
        "id": "c_Q_O",
        "operation": "circle",
        "birth_e_move": 5
      },
      {
        "id": "bisector_QO",
        "operation": "line",
        "birth_e_move": 6
      },
      {
        "id": "c_Qhalf_O",
        "operation": "circle",
        "birth_e_move": 7
      },
      {
        "id": "c_O_Qhalf",
        "operation": "circle",
        "birth_e_move": 8
      },
      {
        "id": "bisector_Qhalf_O",
        "operation": "line",
        "birth_e_move": 9
      },
      {
        "id": "c_Qquarter_Ay",
        "operation": "circle",
        "birth_e_move": 10
      },
      {
        "id": "c_M0_2_Ay",
        "operation": "circle",
        "birth_e_move": 11
      },
      {
        "id": "c_M1_2_Ay",
        "operation": "circle",
        "birth_e_move": 12
      },
      {
        "id": "c_direct_y",
        "operation": "circle",
        "birth_e_move": 13
      },
      {
        "id": "m_center_helper_1",
        "operation": "line",
        "birth_e_move": 14
      },
      {
        "id": "m_center_helper_2",
        "operation": "line",
        "birth_e_move": 15
      },
      {
        "id": "line_Y_H0_4",
        "operation": "line",
        "birth_e_move": 16
      },
      {
        "id": "c_M0_4_Ay",
        "operation": "circle",
        "birth_e_move": 17
      },
      {
        "id": "target_helper_circle",
        "operation": "circle",
        "birth_e_move": 18
      },
      {
        "id": "target_line",
        "operation": "line",
        "birth_e_move": 19
      }
    ],
    "points": [
      {
        "id": "point.O",
        "birth_e_move": 0,
        "aliases": [
          "O"
        ],
        "incident_drawables": [
          "x_axis",
          "y_axis",
          "c_Q_O",
          "c_Qhalf_O"
        ]
      },
      {
        "id": "point.A",
        "birth_e_move": 0,
        "aliases": [
          "A"
        ],
        "incident_drawables": [
          "unit_circle",
          "x_axis",
          "c_Q_A"
        ]
      },
      {
        "id": "point.e01.001",
        "birth_e_move": 1,
        "aliases": [
          "Q"
        ],
        "incident_drawables": [
          "unit_circle",
          "x_axis",
          "c_A_Q",
          "c_Qhalf_O",
          "target_line"
        ]
      },
      {
        "id": "point.e02.001",
        "birth_e_move": 2,
        "aliases": [],
        "incident_drawables": [
          "x_axis",
          "c_A_Q"
        ]
      },
      {
        "id": "point.e03.001",
        "birth_e_move": 3,
        "aliases": [],
        "incident_drawables": [
          "x_axis",
          "c_Q_A"
        ]
      },
      {
        "id": "point.e03.002",
        "birth_e_move": 3,
        "aliases": [
          "y_axis_low"
        ],
        "incident_drawables": [
          "c_A_Q",
          "c_Q_A",
          "y_axis"
        ]
      },
      {
        "id": "point.e03.003",
        "birth_e_move": 3,
        "aliases": [
          "y_axis_high"
        ],
        "incident_drawables": [
          "c_A_Q",
          "c_Q_A",
          "y_axis"
        ]
      },
      {
        "id": "point.e04.001",
        "birth_e_move": 4,
        "aliases": [],
        "incident_drawables": [
          "unit_circle",
          "y_axis",
          "c_Qquarter_Ay",
          "c_M0_2_Ay",
          "c_M1_2_Ay"
        ]
      },
      {
        "id": "point.e04.002",
        "birth_e_move": 4,
        "aliases": [
          "Ay"
        ],
        "incident_drawables": [
          "unit_circle",
          "y_axis",
          "c_Qquarter_Ay",
          "c_M0_2_Ay",
          "c_M1_2_Ay",
          "c_M0_4_Ay"
        ]
      },
      {
        "id": "point.e05.001",
        "birth_e_move": 5,
        "aliases": [],
        "incident_drawables": [
          "x_axis",
          "c_Q_O"
        ]
      },
      {
        "id": "point.e05.002",
        "birth_e_move": 5,
        "aliases": [],
        "incident_drawables": [
          "c_A_Q",
          "c_Q_O"
        ]
      },
      {
        "id": "point.e05.003",
        "birth_e_move": 5,
        "aliases": [],
        "incident_drawables": [
          "c_A_Q",
          "c_Q_O"
        ]
      },
      {
        "id": "point.e05.004",
        "birth_e_move": 5,
        "aliases": [
          "eq_QO_low"
        ],
        "incident_drawables": [
          "unit_circle",
          "c_Q_O",
          "bisector_QO"
        ]
      },
      {
        "id": "point.e05.005",
        "birth_e_move": 5,
        "aliases": [
          "eq_QO_high"
        ],
        "incident_drawables": [
          "unit_circle",
          "c_Q_O",
          "bisector_QO"
        ]
      },
      {
        "id": "point.e06.001",
        "birth_e_move": 6,
        "aliases": [],
        "incident_drawables": [
          "c_Q_A",
          "bisector_QO"
        ]
      },
      {
        "id": "point.e06.002",
        "birth_e_move": 6,
        "aliases": [],
        "incident_drawables": [
          "c_A_Q",
          "bisector_QO"
        ]
      },
      {
        "id": "point.e06.003",
        "birth_e_move": 6,
        "aliases": [
          "Qhalf"
        ],
        "incident_drawables": [
          "x_axis",
          "bisector_QO",
          "c_O_Qhalf"
        ]
      },
      {
        "id": "point.e06.004",
        "birth_e_move": 6,
        "aliases": [],
        "incident_drawables": [
          "c_A_Q",
          "bisector_QO"
        ]
      },
      {
        "id": "point.e06.005",
        "birth_e_move": 6,
        "aliases": [],
        "incident_drawables": [
          "c_Q_A",
          "bisector_QO"
        ]
      },
      {
        "id": "point.e07.001",
        "birth_e_move": 7,
        "aliases": [],
        "incident_drawables": [
          "bisector_QO",
          "c_Qhalf_O"
        ]
      },
      {
        "id": "point.e07.002",
        "birth_e_move": 7,
        "aliases": [
          "direct_y_center"
        ],
        "incident_drawables": [
          "bisector_QO",
          "c_Qhalf_O"
        ]
      },
      {
        "id": "point.e08.001",
        "birth_e_move": 8,
        "aliases": [
          "b_Qhalf_low"
        ],
        "incident_drawables": [
          "c_Qhalf_O",
          "c_O_Qhalf",
          "bisector_Qhalf_O"
        ]
      },
      {
        "id": "point.e08.002",
        "birth_e_move": 8,
        "aliases": [
          "b_Qhalf_high"
        ],
        "incident_drawables": [
          "c_Qhalf_O",
          "c_O_Qhalf",
          "bisector_Qhalf_O"
        ]
      },
      {
        "id": "point.e08.003",
        "birth_e_move": 8,
        "aliases": [],
        "incident_drawables": [
          "c_Q_O",
          "c_O_Qhalf"
        ]
      },
      {
        "id": "point.e08.004",
        "birth_e_move": 8,
        "aliases": [],
        "incident_drawables": [
          "c_Q_O",
          "c_O_Qhalf"
        ]
      },
      {
        "id": "point.e08.005",
        "birth_e_move": 8,
        "aliases": [],
        "incident_drawables": [
          "y_axis",
          "c_O_Qhalf"
        ]
      },
      {
        "id": "point.e08.006",
        "birth_e_move": 8,
        "aliases": [],
        "incident_drawables": [
          "y_axis",
          "c_O_Qhalf"
        ]
      },
      {
        "id": "point.e08.007",
        "birth_e_move": 8,
        "aliases": [
          "positive_half"
        ],
        "incident_drawables": [
          "x_axis",
          "c_O_Qhalf",
          "m_center_helper_2"
        ]
      },
      {
        "id": "point.e09.001",
        "birth_e_move": 9,
        "aliases": [],
        "incident_drawables": [
          "c_Q_A",
          "bisector_Qhalf_O"
        ]
      },
      {
        "id": "point.e09.002",
        "birth_e_move": 9,
        "aliases": [],
        "incident_drawables": [
          "c_A_Q",
          "bisector_Qhalf_O"
        ]
      },
      {
        "id": "point.e09.003",
        "birth_e_move": 9,
        "aliases": [],
        "incident_drawables": [
          "unit_circle",
          "bisector_Qhalf_O"
        ]
      },
      {
        "id": "point.e09.004",
        "birth_e_move": 9,
        "aliases": [],
        "incident_drawables": [
          "c_Q_O",
          "bisector_Qhalf_O"
        ]
      },
      {
        "id": "point.e09.005",
        "birth_e_move": 9,
        "aliases": [
          "Qquarter"
        ],
        "incident_drawables": [
          "x_axis",
          "bisector_Qhalf_O"
        ]
      },
      {